{
  "spec_version": "0.1.0-draft",
  "profile_id": "9d0e6b31-2f47-4c58-8a3b-e1c9f0724d62",
  "rider_ref": "c3a1f7e2-5b8d-4a06-9e21-7d54c2a90b11",
  "derivation": {
    "method": "measured",
    "ride_count": 62,
    "window_days": 180,
    "generated_at": "2026-08-17T12:00:00Z"
  },
  "volume": {
    "typical_ride_distance_km": 42.0,
    "longest_ride_distance_km": 118.0,
    "weekly_distance_km": 95.0,
    "rides_per_week": 2.4
  },
  "pace": {
    "avg_speed_kmh": 21.4,
    "typical_duration_min": 118
  },
  "terrain": {
    "elevation_gain_m_per_km": 9.4
  },
  "surface_mix": {
    "paved_pct": 55,
    "gravel_pct": 40,
    "offroad_pct": 5
  }
}
